{
  "schema_version": 1,
  "date": "2026-10-10",
  "title": "Daily Digest — October 10, 2026",
  "subtitle": "An unsettled world, useful technology, and a telescope made of ice",
  "language": "en",
  "timezone": "America/Boise",
  "published_at": "2026-10-10T21:36:31-06:00",
  "reporting_cutoff": "2026-10-10T21:25:05-06:00",
  "editor_note": "Saturday evening, October 10. Begin with the day's international and U.S. reporting, then move through the economy, Idaho, software, hardware, radio, and science. This first edition also includes clearly dated developments from earlier in the month and selected September background. It is a curated newspaper, not an exhaustive news feed. Company announcements are attributed; analysis is labeled; casualty and outage figures are snapshots rather than final counts.",
  "front_page": ["world-briefing", "isaias-aftermath", "idaho-revenue", "ai-security", "radio-upgrade", "ice-telescope"],
  "articles": [
    {
      "id": "world-briefing",
      "section": "World · Today's reporting",
      "title": "Three conflict reports, with the limits of what is known",
      "dek": "The international briefing: reported attacks, civilian losses, and claims that require attribution.",
      "timing": "Reporting published October 10. The Sudan attack occurred October 9.",
      "paragraphs": [
        {"heading": "Riyadh", "text": "Saudi authorities said a Houthi attack on Riyadh's international airport killed at least 12 people and wounded more than 300 on Saturday. Flights were diverted and operations temporarily suspended. Reuters described it as the airport's third attack this week. President Donald Trump said the United States might join Saudi strikes on the Houthis; he did not announce a decision.", "refs": [1]},
        {"heading": "Sudan", "text": "The Emergency Lawyers rights group said a Friday drone strike killed 41 displaced people, including eight children, in Sudan's Blue Nile province. It blamed the Rapid Support Forces. An RSF spokesperson did not respond to AP's request for comment. The United Nations humanitarian office expressed alarm and called for accountability. The casualty report is attributed to the rights group, not independently established here.", "refs": [2]},
        {"heading": "Gaza", "text": "Medical officials said Israeli strikes killed at least five people in Gaza on Saturday, Reuters reported. Israel said it was targeting militants. Israel accused Hamas of rearming in violation of the October 2025 ceasefire; Hamas denied that accusation and accused Israel of undermining the agreement. The reported deaths and the parties' competing accounts should not be mistaken for a settled explanation of each strike.", "refs": [3]},
        {"heading": "The next useful information", "kind": "analysis", "text": "For these developing stories, the important follow-up is independently corroborated evidence: revised casualty records, a clear account of the targets and weapons involved, and actual policy decisions rather than suggestions of possible action. A newspaper can report an allegation promptly without converting it into an established fact."}
      ],
      "sources": [
        {"publisher": "Reuters", "title": "Houthi attack on Saudi airport kills 12, over 300 wounded, authorities say", "url": "https://www.reuters.com/world/middle-east/loud-blast-heard-riyadh-airport-airlines-cancel-more-flights-2026-10-10/", "published": "2026-10-10"},
        {"publisher": "Associated Press", "title": "Reporting on the drone strike against displaced people in Sudan's Blue Nile province", "url": "https://apnews.com/article/sudan-war-rsf-military-6cb2c34499234e9bcd33c3c9b49521da", "published": "2026-10-10"},
        {"publisher": "Reuters", "title": "Israeli strikes kill five people in Gaza, medics say", "url": "https://www.reuters.com/world/middle-east/israeli-strikes-kill-five-people-gaza-medics-say-2026-10-10/", "published": "2026-10-10"}
      ]
    },
    {
      "id": "isaias-aftermath",
      "section": "United States · Today's reporting",
      "title": "After Isaias, the recovery is larger than the wind category",
      "dek": "The storm's aftermath matters even after the hurricane label disappears.",
      "timing": "October 10 reporting and National Hurricane Center discussion. Conditions may change after the edition cutoff.",
      "paragraphs": [
        {"text": "Reuters reported four deaths and roughly 670,000 customers without electricity across Florida, Alabama, Georgia, and Mississippi after Isaias. The report described a Category 2 landfall near Destin, Florida. These are publication-time figures, not a final accounting of damage or outages.", "refs": [1]},
        {"text": "The National Hurricane Center's October 10 discussion classified Isaias as post-tropical after rapid weakening over Alabama. That classification describes the storm's structure; it is not a declaration that every local consequence has ended. The center's continuing notices highlighted the threat from flooding as the system moved through the Southeast.", "refs": [2, 3]},
        {"heading": "What a recovery story should measure", "kind": "analysis", "text": "A useful next-day account should follow restored service, reopened routes, displaced households, and the places where water is still rising. A single regional outage total can conceal very different experiences: a brief interruption for one neighborhood and a much longer failure for another. The better question is not simply whether the storm weakened, but which essential systems remain unavailable and to whom."},
        {"kind": "analysis", "text": "For an offline newspaper, the distinction is especially important. This page preserves what was known at publication; it is not a live warning service. Decisions about travel or immediate hazards should rely on the latest local emergency information rather than an archived edition."}
      ],
      "sources": [
        {"publisher": "Reuters", "title": "Isaias landfall and aftermath reporting", "url": "https://www.reuters.com/business/environment/category-3-hurricane-isaias-makes-landfall-near-destin-florida-nhc-says-2026-10-10/", "published": "2026-10-10"},
        {"publisher": "NOAA National Hurricane Center", "title": "Isaias forecast discussion, October 10", "url": "https://www.nhc.noaa.gov/mobile/text/refresh/MIATCDAT4%2Bhtml/080856.shtml", "published": "2026-10-10"},
        {"publisher": "NOAA National Hurricane Center", "title": "Current storm notices and flooding information, checked October 10", "url": "https://www.nhc.noaa.gov/", "published": null}
      ]
    },
    {
      "id": "economy-crosscurrents",
      "section": "Economy · This week",
      "title": "AI investment, energy disruption, and the bill for public debt",
      "dek": "The IMF's framing is a reminder that a technology boom and an economic squeeze can coexist.",
      "timing": "An October 7 speech ahead of the IMF and World Bank annual meetings; not a new forecast issued today.",
      "paragraphs": [
        {"text": "In her October 7 curtain-raiser speech, IMF Managing Director Kristalina Georgieva described three forces acting together: AI-related investment, energy disruption, and the burden of public debt. Her argument was not that one of these stories cancels the others. Productive investment can support activity while energy constraints and financing costs pressure households, businesses, and governments.", "refs": [1]},
        {"text": "The speech emphasized the concentration of AI-related production and spending, exposure to energy shocks, and the need for credible fiscal plans. It treated potential AI productivity gains as conditional rather than an automatic dividend. Skills, infrastructure, and the way investment spreads through the economy remain part of the question.", "refs": [1]},
        {"heading": "Investment is not yet the same as a payoff", "kind": "analysis", "text": "Consider a hypothetical business that buys twice as much computing equipment but has not yet changed its output. Its supplier has already booked a sale; the buyer has not necessarily earned a return. Both observations can be true. To judge a technology boom, the useful follow-up is therefore not only how much capacity is being purchased, but what customers can now produce more reliably or at lower total cost."},
        {"kind": "analysis", "text": "The same discipline applies to economic headlines. Separate a forecast from an observation, a spending surge from an efficiency gain, and a temporary price shock from a permanent change in operating costs. Those distinctions are more informative than treating every development as either proof of a boom or evidence of an imminent collapse."}
      ],
      "sources": [
        {"publisher": "International Monetary Fund", "title": "Navigating the Crosscurrents of a Changing World Economy", "url": "https://www.imf.org/en/news/articles/2026/10/07/sp100726-2026-annual-meetings-curtain-raiser", "published": "2026-10-07"}
      ]
    },
    {
      "id": "idaho-revenue",
      "section": "Idaho · Public finances",
      "title": "State revenue beats the forecast again",
      "dek": "A better-than-expected quarter is encouraging, but it is not the same thing as a permanent surplus.",
      "timing": "Reported October 9; figures cover September and the first quarter of fiscal year 2027.",
      "paragraphs": [
        {"text": "Idaho collected about $39 million more general-fund revenue in September than projected, roughly 7% above the monthly forecast, the Idaho Capital Sun reported. For the first three months of fiscal year 2027, collections were approximately $90.3 million, or 6.8%, above projections. It was the third consecutive month ahead of the forecast.", "refs": [1]},